[
  {
    "id": "youtube-t0k4WndiQxk",
    "title": "Learn Meta Ads Step-by-Step | Full Course",
    "publisher": "Jim's Digital Marketing",
    "url": "https://youtu.be/t0k4WndiQxk",
    "sourceType": "VIDEO_COURSE",
    "publishedAt": "2025-10-23",
    "extractedAt": "2026-07-16",
    "status": "REVIEWED",
    "notes": "Course guidance only. Extract claims with timecodes and classify individually. Reviewed claims: sources/youtube/youtube-t0k4WndiQxk/reviewed/claims.json (extracted from a human-supplied caption transcript; several claims flagged NEEDS_REVIEW pending official Meta documentation checks)."
  },
  {
    "id": "youtube-BiRlATLFEww",
    "title": "f*ck it, full facebook ads course for beginners (12 hours)",
    "publisher": "Brandon Willington",
    "url": "https://youtu.be/BiRlATLFEww",
    "sourceType": "VIDEO_COURSE",
    "publishedAt": "2026-05-31",
    "extractedAt": "2026-07-16",
    "status": "REVIEWED",
    "notes": "Course guidance only. Separate general principles from account-specific claims. Reviewed claims: sources/youtube/youtube-BiRlATLFEww/reviewed/claims.json (extracted from a human-supplied caption transcript; several claims flagged NEEDS_REVIEW pending official Meta documentation checks)."
  },
  {
    "id": "youtube-PakHu2sKTvQ",
    "title": "The BEST Meta Ads Course From Setup to Scaling Success",
    "publisher": "Professor Charley T",
    "url": "https://youtu.be/PakHu2sKTvQ",
    "sourceType": "VIDEO_COURSE",
    "publishedAt": "2024-10-22",
    "extractedAt": "2026-07-16",
    "status": "REVIEWED",
    "notes": "Review UI and settings guidance for freshness before reuse. Reviewed claims: sources/youtube/youtube-PakHu2sKTvQ/reviewed/claims.json (extracted from a human-supplied caption transcript; several claims flagged NEEDS_REVIEW pending official Meta documentation checks; conflicts with youtube-t0k4WndiQxk on lookalike/retargeting audiences)."
  },
  {
    "id": "meta-marketing-api",
    "title": "Meta Marketing API Documentation",
    "publisher": "Meta",
    "url": "https://developers.facebook.com/docs/marketing-api/",
    "sourceType": "OFFICIAL_DOCUMENTATION",
    "extractedAt": "2026-07-15",
    "status": "REGISTERED",
    "notes": "Primary source for API behavior; validate freshness at implementation time."
  },
  {
    "id": "meta-advertising-standards",
    "title": "Meta Advertising Standards",
    "publisher": "Meta",
    "url": "https://transparency.meta.com/policies/ad-standards/",
    "sourceType": "OFFICIAL_POLICY",
    "extractedAt": "2026-07-15",
    "status": "REGISTERED",
    "notes": "Primary policy source; final enforcement remains Meta's decision."
  },
  {
    "id": "five-star-course-page",
    "title": "Certificate II in Security Operations (CPP20218)",
    "publisher": "Five Star Training Academy",
    "url": "https://fivestartraining.edu.au/courses/certificate-ii-in-security-operations/",
    "sourceType": "COMPANY_WEBSITE",
    "extractedAt": "2026-07-16",
    "status": "REVIEWED",
    "notes": "Public offer, location, price, and course-claim context only. Price, funding, availability, and outcome claims require client confirmation before ads use them."
  },
  {
    "id": "five-star-training-calendar",
    "title": "2026 Training Calendar",
    "publisher": "Five Star Training Academy",
    "url": "https://fivestartrainingacademy.jotform.com/app/261661011297958",
    "sourceType": "COMPANY_WEBSITE",
    "extractedAt": "2026-07-16",
    "status": "REVIEWED",
    "notes": "A public embedded calendar. It supports location/date research but does not reliably expose live seats or enrolment availability."
  },
  {
    "id": "qld-unarmed-security-licence",
    "title": "Apply for an unarmed security officer licence",
    "publisher": "Queensland Government",
    "url": "https://www.qld.gov.au/community/fair-trading/regulated-industries-licensing-and-legislation/security-industry-regulation/working-as-an-unarmed-security-officer/apply",
    "sourceType": "OFFICIAL_DOCUMENTATION",
    "extractedAt": "2026-07-16",
    "status": "REVIEWED",
    "notes": "Primary source for current Queensland licence requirements. Use to review training and licence claims before publishing ads."
  }
]
